{"contractVersion":"1.0.0","corpusRelease":"gen_concordance_data.py (H1505)","generatedBy":"src/DCS-data-2026/build_learner_contracts.py (H2481)","passageCount":40,"passages":[{"passageId":"vdcs:v1:passage:hitopade-a:0","sourceId":0,"title":"Hitopadeśa","genre":"Narrative Prose","diff":1,"desc":"Hitopadeśa — prose fable, maxim + story","src":"Hitop, 1: 1","txt":"anyac ca | udyoginaṁ puruṣasiṁham upaiti lakṣmīr daivena deyam iti kāpuruṣā vadanti | daivaṁ nihatya kuru pauruṣam ātmaśaktyā yatne kṛte yadi na sidhyati ko .tra doṣaḥ || yathā mṛtpiṇḍataḥ kartā kurute yad yad icchati | evam ātmakṛtaṁ karma mānavaḥ pratipadyate || kākatālīyavat prāptaṁ dṛṣṭvāpi nidhim agrataḥ | na svayaṁ daivam ādatte puruṣārtham apekṣate ||","vd":0.26,"linkedFormCount":2},{"passageId":"vdcs:v1:passage:hitopade-a:1","sourceId":1,"title":"Hitopadeśa","genre":"Narrative Prose","diff":1,"desc":"Hitopadeśa — prose fable, maxim + story","src":"Hitop, 2: 2","txt":"anyac ca | ṣaḍdoṣāḥ puruṣeṇeha hātavyā bhūtim icchatā | nidrā tandrā bhayaṁ krodha ālasyaṁ dīrghasūtratā || idānīm api evaṁ kriyatāṁ sarvair ekacittībhūya jālam ādāya uḍḍīyatām | yataḥ | alpānām api vastūnāṁ saṁhatiḥ kāryasādhikā | tṛṇair guṇatvam āpannair badhyante mattadantinaḥ || saṁhatiḥ śreyasī puṁsāṁ svakulair alpakair api | tuṣeṇāpi parityaktā na prarohanti taṇḍulāḥ ||","vd":0.02,"linkedFormCount":1},{"passageId":"vdcs:v1:passage:hitopade-a:2","sourceId":2,"title":"Hitopadeśa","genre":"Narrative Prose","diff":1,"desc":"Hitopadeśa — prose fable, maxim + story","src":"Hitop, 2: 2","txt":"kāko brūte mitra kāpuruṣasya vacanam etat | yataḥ | sthānam utsṛjya gacchanti siṁhāḥ satpuruṣā gajāḥ | tatraiva nidhanaṁ yānti kākāḥ kāpuruṣā mṛgāḥ || anyac ca | ko vīrasya manasvinaḥ svaviṣayaḥ ko vā videśaḥ smṛtaḥ yaṁ deśaṁ śrayate tam eva kurute bāhupratāpārjitam | yad daṁṣṭrānakhalāṅgulapraharaṇaḥ siṁho vanaṁ gāhate tasminn eva hatadvipendrarudhirais tṛṣṇāṁ chinatty ātmanaḥ || hiraṇyako brūte mitra kva gantavyam tathā coktam | calaty ekena pādena tiṣṭhaty ekena buddhimān | nāsamīkṣya paraṁ sthānaṁ pūrvam āyatanaṁ tyajet ||","vd":0.12,"linkedFormCount":1},{"passageId":"vdcs:v1:passage:hitopade-a:3","sourceId":3,"title":"Hitopadeśa","genre":"Narrative Prose","diff":1,"desc":"Hitopadeśa — prose fable, maxim + story","src":"Hitop, 2: 2","txt":"anyac ca | asaṁbhogena sāmānyaṁ kṛpaṇasya dhanaṁ paraiḥ | asyedam iti sambandho hānau duḥkhena gamyate || api ca | na devāya na viprāya na bandhubhyo na cātmane | kṛpaṇasya dhanaṁ yāti vahnitaskarapārthivaiḥ || tathā coktam | dānaṁ priyavāksahitaṁ jñānam agarvaṁ kṣamānvitaṁ śauryam | tyāgaṁ sahitaṁ ca vittaṁ durlabham etac catur bhadram ||","vd":0.05,"linkedFormCount":1},{"passageId":"vdcs:v1:passage:hitopade-a:4","sourceId":4,"title":"Hitopadeśa","genre":"Narrative Prose","diff":1,"desc":"Hitopadeśa — prose fable, maxim + story","src":"Hitop, 3: 3","txt":"damanako brūte bhadra katham ahaṁ sevānabhijñaḥ paśya | kim apy asti svabhāvena sundaraṁ vāpy asundaram | yad eva rocate yasmai bhavet tat tasya sundaram || yataḥ | yasya yasya hi yo bhāvas tena tena hi taṁ naram | anupraviśya medhāvī kṣipram ātmavaśaṁ nayet || anyac ca | ko .trety aham iti brūyāt samyag ādeśayeti ca | ājñām avitathāṁ kuryād yathāśakti mahīpateḥ ||","vd":0.15,"linkedFormCount":1},{"passageId":"vdcs:v1:passage:a-vakrag-ta:5","sourceId":5,"title":"Aṣṭāvakragīta","genre":"Philosophy","diff":2,"desc":"Aṣṭāvakragīta — non-dual teaching in simple śloka","src":"Aṣṭāvakragīta, 1: 1","txt":"janaka uvāca | kathaṁ jñānam avāpnoti kathaṁ muktir bhaviṣyati | vairāgyaṁ ca kathaṁ prāptam etad brūhi mama prabho || aṣṭāvakra uvāca | muktim icchasi cet tāta viṣayān viṣavat tyaja | kṣamārjavadayātoṣasatyaṁ pīyūṣavad bhaja || na pṛthvī na jalaṁ nāgnir na vāyur dyaur na vā bhavān | eṣāṁ sākṣiṇam ātmānaṁ cidrūpaṁ viddhi muktaye ||","vd":0.2,"linkedFormCount":6},{"passageId":"vdcs:v1:passage:a-vakrag-ta:6","sourceId":6,"title":"Aṣṭāvakragīta","genre":"Philosophy","diff":2,"desc":"Aṣṭāvakragīta — non-dual teaching in simple śloka","src":"Aṣṭāvakragīta, 2: 2","txt":"janaka uvāca | aho nirañjanaḥ śānto bodho .haṁ prakṛteḥ paraḥ | etāvantam ahaṁ kālaṁ mohenaiva viḍambitaḥ || yathā prakāśayāmy eko deham enaṁ tathā jagat | ato mama jagat sarvam athavā na ca kiṁcana || saśarīram aho viśvaṁ parityajya mayādhunā | kutaścit kauśalād eva paramātmā vilokyate ||","vd":0.05,"linkedFormCount":1},{"passageId":"vdcs:v1:passage:a-vakrag-ta:7","sourceId":7,"title":"Aṣṭāvakragīta","genre":"Philosophy","diff":2,"desc":"Aṣṭāvakragīta — non-dual teaching in simple śloka","src":"Aṣṭāvakragīta, 8: 8","txt":"tadā bandho yadā cittaṁ kiṁcid vāñchati śocati | kiṁcin muñcati gṛhṇāti kiṁciddhṛṣyati kupyati || tadā muktir yadā cittaṁ na vāñchati na śocati | na muñcati na gṛhṇāti na hṛṣyati na kupyati || tadā bandho yadā cittaṁ saktaṁ kāsvapi dṛṣṭiṣu | tadā mokṣo yadā cittam asaktaṁ sarvadṛṣṭiṣu ||","vd":0.27,"linkedFormCount":3},{"passageId":"vdcs:v1:passage:a-vakrag-ta:8","sourceId":8,"title":"Aṣṭāvakragīta","genre":"Philosophy","diff":2,"desc":"Aṣṭāvakragīta — non-dual teaching in simple śloka","src":"Aṣṭāvakragīta, 17: 17","txt":"tena jñānaphalaṁ prāptaṁ yogābhyāsaphalaṁ tathā | tṛptaḥ svacchendriyo nityam ekākī ramate tu yaḥ || na kadācij jagaty asmiṁs tattvajño hanta khidyati | yata ekena tenedaṁ pūrṇaṁ brahmāṇḍamaṇḍalam || na jātu viṣayāḥ ke.pi svārāmaṁ harṣayanty amī | sallakīpallavaprītam ivebhaṁ nimbapallavāḥ ||","vd":0.06,"linkedFormCount":2},{"passageId":"vdcs:v1:passage:manusm-ti:9","sourceId":9,"title":"Manusmṛti","genre":"Sūtra/Dharma","diff":3,"desc":"Manusmṛti — dharmaśāstra, optative-heavy prescriptions","src":"ManuS, 5: 5","txt":"yad dhyāyati yat kurute ratiṁ badhnāti yatra ca | tad avāpnoty ayatnena yo hinasti na kiṁcana || nākṛtvā prāṇināṁ hiṁsāṁ māṁsam utpadyate kvacit | na ca prāṇivadhaḥ svargyas tasmānmāṁsaṁ vivarjayet || samutpattiṁ ca māṁsasya vadhabandhau ca dehinām | prasamīkṣya nivarteta sarvamāṁsasya bhakṣaṇāt || na bhakṣayati yo māṁsaṁ vidhiṁ hitvā piśācavat | na loke priyatāṁ yāti vyādhibhiś ca na pīḍyate ||","vd":0.25,"linkedFormCount":2},{"passageId":"vdcs:v1:passage:manusm-ti:10","sourceId":10,"title":"Manusmṛti","genre":"Sūtra/Dharma","diff":3,"desc":"Manusmṛti — dharmaśāstra, optative-heavy prescriptions","src":"ManuS, 7: 7","txt":"adyāt kākaḥ puroḍāśaṁ śvā ca lihyāddhavis tathā | svāmyaṁ ca na syāt kasmiṁścit pravartetādharottaram || sarvo daṇḍajito loko durlabho hi śucir naraḥ | daṇḍasya hi bhayāt sarvaṁ jagad bhogāya kalpate || devadānavagandharvā rakṣāṁsi patagoragāḥ | te .pi bhogāya kalpante daṇḍenaiva nipīḍitāḥ || duṣyeyuḥ sarvavarṇāś ca bhidyeran sarvasetavaḥ | sarvalokaprakopaś ca bhaved daṇḍasya vibhramāt ||","vd":0.11,"linkedFormCount":0},{"passageId":"vdcs:v1:passage:manusm-ti:11","sourceId":11,"title":"Manusmṛti","genre":"Sūtra/Dharma","diff":3,"desc":"Manusmṛti — dharmaśāstra, optative-heavy prescriptions","src":"ManuS, 8: 8","txt":"andho matsyān ivāśnāti sa naraḥ kaṇṭakaiḥ saha | yo bhāṣate .rthavaikalyam apratyakṣaṁ sabhāṁ gataḥ || yasya vidvān hi vadataḥ kṣetrajño nābhiśaṅkate | tasmān na devāḥ śreyāṁsaṁ loke .nyaṁ puruṣaṁ viduḥ || yāvato bāndhavān yasmin hanti sākṣye .nṛtaṁ vadan | tāvataḥ saṁkhyayā tasmin śṛṇu saumyānupūrvaśaḥ || pañca paśvanṛte hanti daśa hanti gavānṛte | śatam aśvānṛte hanti sahasraṁ puruṣānṛte ||","vd":0.14,"linkedFormCount":0},{"passageId":"vdcs:v1:passage:r-m-ya-a:12","sourceId":12,"title":"Rāmāyaṇa","genre":"Epic","diff":3,"desc":"Rāmāyaṇa — epic narrative with perfect & imperfect","src":"Rām, 1, 1: 1","txt":"tapaḥsvādhyāyanirataṁ tapasvī vāgvidāṁ varam | nāradaṁ paripapraccha vālmīkir munipuṁgavam || ko nv asmin sāmprataṁ loke guṇavān kaś ca vīryavān | dharmajñaś ca kṛtajñaś ca satyavākyo dṛḍhavrataḥ || cāritreṇa ca ko yuktaḥ sarvabhūteṣu ko hitaḥ | vidvān kaḥ kaḥ samarthaś ca kaś caikapriyadarśanaḥ || ātmavān ko jitakrodho matimān ko .nasūyakaḥ | kasya bibhyati devāś ca jātaroṣasya saṁyuge ||","vd":0.06,"linkedFormCount":0},{"passageId":"vdcs:v1:passage:r-m-ya-a:13","sourceId":13,"title":"Rāmāyaṇa","genre":"Epic","diff":3,"desc":"Rāmāyaṇa — epic narrative with perfect & imperfect","src":"Rām, 1, 35: 35","txt":"abhigamya surāḥ sarve praṇipatyedam abruvan | devadeva mahādeva lokasyāsya hite rata | surāṇāṁ praṇipātena prasādaṁ kartum arhasi || na lokā dhārayiṣyanti tava tejaḥ surottama | brāhmeṇa tapasā yukto devyā saha tapaś cara || trailokyahitakāmārthaṁ tejas tejasi dhāraya | rakṣa sarvān imāṁl lokān nālokaṁ kartum arhasi || devatānāṁ vacaḥ śrutvā sarvalokamaheśvaraḥ | bāḍham ity abravīt sarvān punaś cedam uvāca ha ||","vd":0.27,"linkedFormCount":7},{"passageId":"vdcs:v1:passage:r-m-ya-a:14","sourceId":14,"title":"Rāmāyaṇa","genre":"Epic","diff":3,"desc":"Rāmāyaṇa — epic narrative with perfect & imperfect","src":"Rām, 2, 109: 185","txt":"skandhāvāraniveśena tena tasya mahātmanaḥ | hayahastikarīṣaiś ca upamardaḥ kṛto bhṛśam || tasmād anyatra gacchāma iti saṁcintya rāghavaḥ | prātiṣṭhata sa vaidehyā lakṣmaṇena ca saṁgataḥ || so .trer āśramam āsādya taṁ vavande mahāyaśāḥ | taṁ cāpi bhagavān atriḥ putravat pratyapadyata || svayam ātithyam ādiśya sarvam asya susatkṛtam | saumitriṁ ca mahābhāgāṁ sītāṁ ca samasāntvayat ||","vd":0.13,"linkedFormCount":2},{"passageId":"vdcs:v1:passage:r-m-ya-a:15","sourceId":15,"title":"Rāmāyaṇa","genre":"Epic","diff":3,"desc":"Rāmāyaṇa — epic narrative with perfect & imperfect","src":"Rām, 6, 59: 449","txt":"na hi madbāhusṛṣṭānām astrāṇāṁ himavān api | soḍhum utsahate vegam antarikṣam atho mahī || sukhaprasuptaṁ kālāgniṁ prabodhayitum icchasi | nyasya cāpaṁ nivartasva mā prāṇāñ jahi madgataḥ || athavā tvaṁ pratiṣṭabdho na nivartitum icchasi | tiṣṭha prāṇān parityajya gamiṣyasi yamakṣayam || paśya me niśitān bāṇān aridarpaniṣūdanān | īśvarāyudhasaṁkāśāṁstaptakāñcanabhūṣaṇān ||","vd":0.3,"linkedFormCount":0},{"passageId":"vdcs:v1:passage:mah-bh-rata:16","sourceId":16,"title":"Mahābhārata","genre":"Epic","diff":3,"desc":"Mahābhārata — full epic range of tenses","src":"MBh, 3, 297: 595","txt":"yakṣa uvāca | kaś ca dharmaḥ paro loke kaśca d